{
  "slug": "irodriguez",
  "name": "Rodríguez Galiano, Mª Isabel",
  "image": "/assets/uploads/2016/11/rodriguez-galiano-isabel.png",
  "office": "2204",
  "web": "",
  "phone": "+34-91-067-2905",
  "orcid": "",
  "email": "irodriguez@fi.upm.es",
  "researcherId": "",
  "researchGroup": {
    "name": "Grupo de Análisis de Decisiones y Estadística",
    "url": "/dasg/"
  },
  "scopusId": "",
  "biography": [],
  "category": "profesor-titular",
  "date": "2016-11-22T10:57:44+00:00",
  "thumbnail": {
    "src": "/assets/uploads/2016/11/rodriguez-galiano-isabel.png",
    "width": 490,
    "height": 490,
    "alt": ""
  },
  "readingTime": "1 minuto de lectura",
  "seo": {
    "title": "Rodríguez Galiano, Mª Isabel - Departamento de Inteligencia Artificial",
    "ogTitle": "Rodríguez Galiano, Mª Isabel - Departamento de Inteligencia Artificial",
    "ogType": "article",
    "image": "/assets/uploads/2016/11/rodriguez-galiano-isabel.png",
    "modifiedTime": "2024-01-16T23:12:52+00:00",
    "robots": "index, follow, max-image-preview:large, max-snippet:-1, max-video-preview:-1"
  }
}
