{
  "slug": "bmihaljevic",
  "name": "Mihaljevic, Bojan",
  "image": "/assets/uploads/2024/07/bojan.jpg",
  "office": "3205",
  "web": "https://bmihaljevic.github.io/",
  "phone": "+34-91-067-2903",
  "orcid": "https://orcid.org/0000-0002-1656-6135",
  "email": "b.mihaljevic@upm.es",
  "researcherId": "",
  "researchGroup": null,
  "scopusId": "",
  "biography": [],
  "category": "profesores-permanentes-laborales",
  "date": "2022-05-13T09:41:47+00:00",
  "thumbnail": {
    "src": "/assets/uploads/2024/07/bojan.jpg",
    "width": 490,
    "height": 490,
    "alt": ""
  },
  "readingTime": "1 minuto de lectura",
  "seo": {
    "title": "Mihaljevic, Bojan - Departamento de Inteligencia Artificial",
    "ogTitle": "Mihaljevic, Bojan - Departamento de Inteligencia Artificial",
    "ogType": "article",
    "image": "/assets/uploads/2024/07/bojan.jpg",
    "modifiedTime": "2024-07-10T10:49:05+00:00",
    "robots": "index, follow, max-image-preview:large, max-snippet:-1, max-video-preview:-1"
  }
}
