{
  "slug": "pablocalleja",
  "name": "Calleja Ibáñez, Pablo",
  "image": "/assets/uploads/2023/04/pablo-calleja-1.png",
  "office": "3206",
  "web": "",
  "phone": "",
  "orcid": "",
  "email": "p.calleja@upm.es",
  "researcherId": "",
  "researchGroup": null,
  "scopusId": "",
  "biography": [],
  "category": "profesores-permanentes-laborales",
  "date": "2023-04-28T07:37:48+00:00",
  "thumbnail": {
    "src": "/assets/uploads/2023/04/pablo-calleja-1.png",
    "width": 490,
    "height": 490,
    "alt": ""
  },
  "readingTime": "1 minuto de lectura",
  "seo": {
    "title": "Calleja Ibáñez, Pablo - Departamento de Inteligencia Artificial",
    "ogTitle": "Calleja Ibáñez, Pablo - Departamento de Inteligencia Artificial",
    "ogType": "article",
    "image": "/assets/uploads/2023/04/pablo-calleja-1.png",
    "modifiedTime": "2026-01-21T12:36:15+00:00",
    "robots": "index, follow, max-image-preview:large, max-snippet:-1, max-video-preview:-1"
  }
}
