{
  "slug": "mariapoveda",
  "name": "Poveda Villalón, María",
  "image": "/assets/uploads/2019/05/Maria-Poveda.png",
  "office": "3205",
  "web": "",
  "phone": "+34 91-067-7288",
  "orcid": "",
  "email": "mpoveda@fi.upm.es",
  "researcherId": "",
  "researchGroup": null,
  "scopusId": "",
  "biography": [],
  "category": "profesor-titular",
  "date": "2019-05-13T07:26:28+00:00",
  "thumbnail": {
    "src": "/assets/uploads/2019/05/Maria-Poveda.png",
    "width": 490,
    "height": 490,
    "alt": ""
  },
  "readingTime": "1 minuto de lectura",
  "seo": {
    "title": "Poveda Villalón, María - Departamento de Inteligencia Artificial",
    "ogTitle": "Poveda Villalón, María - Departamento de Inteligencia Artificial",
    "ogType": "article",
    "image": "/assets/uploads/2019/05/Maria-Poveda.png",
    "modifiedTime": "2026-01-21T12:38:15+00:00",
    "robots": "index, follow, max-image-preview:large, max-snippet:-1, max-video-preview:-1"
  }
}
