{
  "slug": "jmbarreiro",
  "name": "Barreiro Sorrivas, José Mª",
  "image": "/assets/uploads/2016/11/jose-barreiro-sorrivas.png",
  "office": "2108",
  "web": "",
  "phone": "+34-91-067-2882",
  "orcid": "https://orcid.org/0000-0001-6626-5835",
  "email": "jmbarreiro@fi.upm.es",
  "researcherId": "http://www.researcherid.com/rid/G-1389-2016",
  "researchGroup": null,
  "scopusId": "https://www.scopus.com/authid/detail.uri?authorId=7005345873",
  "biography": [],
  "category": "profesor-titular",
  "date": "2016-11-22T10:55:31+00:00",
  "thumbnail": {
    "src": "/assets/uploads/2016/11/jose-barreiro-sorrivas.png",
    "width": 490,
    "height": 490,
    "alt": ""
  },
  "readingTime": "1 minuto de lectura",
  "seo": {
    "title": "Barreiro Sorrivas, José Mª - Departamento de Inteligencia Artificial",
    "ogTitle": "Barreiro Sorrivas, José Mª - Departamento de Inteligencia Artificial",
    "ogType": "article",
    "image": "/assets/uploads/2016/11/jose-barreiro-sorrivas.png",
    "modifiedTime": "2024-01-16T23:09:41+00:00",
    "robots": "index, follow, max-image-preview:large, max-snippet:-1, max-video-preview:-1"
  }
}
