{
  "slug": "dperezdelrey",
  "name": "Pérez del Rey, David",
  "image": "/assets/uploads/2016/11/david-perez-del-rey.png",
  "office": "2206",
  "web": "http://gib.fi.upm.es/dperez",
  "phone": "91 06 72975 / 73118",
  "orcid": "",
  "email": "dperezdelrey@fi.upm.es",
  "researcherId": "",
  "researchGroup": {
    "name": "Grupo de Informática Biomédica",
    "url": "http://www.gib.fi.upm.es"
  },
  "scopusId": "",
  "biography": [],
  "category": "profesor-titular",
  "date": "2016-11-22T11:06:30+00:00",
  "thumbnail": {
    "src": "/assets/uploads/2016/11/david-perez-del-rey.png",
    "width": 490,
    "height": 490,
    "alt": ""
  },
  "readingTime": "1 minuto de lectura",
  "seo": {
    "title": "Pérez del Rey, David - Departamento de Inteligencia Artificial",
    "ogTitle": "Pérez del Rey, David - Departamento de Inteligencia Artificial",
    "ogType": "article",
    "image": "/assets/uploads/2016/11/david-perez-del-rey.png",
    "modifiedTime": "2024-05-06T18:02:02+00:00",
    "robots": "index, follow, max-image-preview:large, max-snippet:-1, max-video-preview:-1"
  }
}
