{
  "slug": "sgarcia",
  "name": "García Rodrigo, Salomé Paula",
  "image": "/assets/uploads/2023/10/Garcia-Rodrigo-Salome-Paula.png",
  "office": "2213",
  "web": "",
  "phone": "+34-91-067-3074",
  "orcid": "",
  "email": "sgarcia@fi.upm.es",
  "researcherId": "",
  "researchGroup": null,
  "scopusId": "",
  "biography": [],
  "category": "personal-tecnico-de-gestion-y-de-administracion-y-servicios",
  "date": "2016-11-22T11:19:25+00:00",
  "thumbnail": {
    "src": "/assets/uploads/2023/10/Garcia-Rodrigo-Salome-Paula.png",
    "width": 499,
    "height": 499,
    "alt": ""
  },
  "readingTime": "1 minuto de lectura",
  "seo": {
    "title": "García Rodrigo, Salomé Paula - Departamento de Inteligencia Artificial",
    "ogTitle": "García Rodrigo, Salomé Paula - Departamento de Inteligencia Artificial",
    "ogType": "article",
    "image": "/assets/uploads/2023/10/Garcia-Rodrigo-Salome-Paula.png",
    "modifiedTime": "2024-01-16T23:19:01+00:00",
    "robots": "index, follow, max-image-preview:large, max-snippet:-1, max-video-preview:-1"
  }
}
