{
  "slug": "reyes",
  "name": "Riera López, Reyes",
  "image": "/assets/uploads/2024/02/Reyes-lopez.png",
  "office": "2214",
  "web": "",
  "phone": "+34-91-067-3082",
  "orcid": "",
  "email": "reyes@fi.upm.es",
  "researcherId": "",
  "researchGroup": null,
  "scopusId": "",
  "biography": [],
  "category": "personal-tecnico-de-gestion-y-de-administracion-y-servicios",
  "date": "2016-11-22T11:19:50+00:00",
  "thumbnail": {
    "src": "/assets/uploads/2024/02/Reyes-lopez.png",
    "width": 490,
    "height": 490,
    "alt": ""
  },
  "readingTime": "1 minuto de lectura",
  "seo": {
    "title": "Riera López, Reyes - Departamento de Inteligencia Artificial",
    "ogTitle": "Riera López, Reyes - Departamento de Inteligencia Artificial",
    "ogType": "article",
    "image": "/assets/uploads/2024/02/Reyes-lopez.png",
    "modifiedTime": "2024-02-16T11:42:34+00:00",
    "robots": "index, follow, max-image-preview:large, max-snippet:-1, max-video-preview:-1"
  }
}
