{
  "slug": "herme",
  "name": "Hermenegildo Salinas, Manuel",
  "image": "/assets/uploads/2016/11/Hermegildo-Salinas-Manuel.png",
  "office": "2212",
  "web": "http://www.clip.dia.fi.upm.es/~herme",
  "phone": "+34-91-067-2893",
  "orcid": "https://orcid.org/0000-0002-7583-323X",
  "email": "herme@fi.upm.es",
  "researcherId": "http://www.researcherid.com/rid/I-4418-2015",
  "researchGroup": {
    "name": "The Computational logic, Languages, Implementation, and Parallelism Laboratory",
    "url": "http://cliplab.org"
  },
  "scopusId": "https://www.scopus.com/authid/detail.uri?authorId=7004271854",
  "biography": [],
  "category": "catedraticos",
  "date": "2016-11-21T11:41:11+00:00",
  "thumbnail": {
    "src": "/assets/uploads/2016/11/Hermegildo-Salinas-Manuel.png",
    "width": 490,
    "height": 490,
    "alt": ""
  },
  "readingTime": "1 minuto de lectura",
  "seo": {
    "title": "Hermenegildo Salinas, Manuel - Departamento de Inteligencia Artificial",
    "ogTitle": "Hermenegildo Salinas, Manuel - Departamento de Inteligencia Artificial",
    "ogType": "article",
    "image": "/assets/uploads/2016/11/Hermegildo-Salinas-Manuel.png",
    "modifiedTime": "2024-01-16T23:08:30+00:00",
    "robots": "index, follow, max-image-preview:large, max-snippet:-1, max-video-preview:-1"
  }
}
