{
  "slug": "jgpachon",
  "name": "González Pachón, Jacinto",
  "image": "/assets/uploads/2016/11/gonzalez-pacjon-jacinto.png",
  "office": "2101",
  "web": "https://dia.fi.upm.es/~jgpachon",
  "phone": "+34-91-067-2892",
  "orcid": "https://orcid.org/0000-0003-0874-8753",
  "email": "jgpachon@fi.upm.es",
  "researcherId": "http://www.researcherid.com/rid/F-6493-2010",
  "researchGroup": {
    "name": "Grupo de Economía y Sostenibilidad del Medio Natural",
    "url": "http://www.ecsen.es"
  },
  "scopusId": "https://www.scopus.com/authid/detail.uri?authorId=6603402491",
  "biography": [],
  "category": "profesor-titular",
  "date": "2016-11-22T10:56:27+00:00",
  "thumbnail": {
    "src": "/assets/uploads/2016/11/gonzalez-pacjon-jacinto.png",
    "width": 490,
    "height": 490,
    "alt": ""
  },
  "readingTime": "1 minuto de lectura",
  "seo": {
    "title": "González Pachón, Jacinto - Departamento de Inteligencia Artificial",
    "ogTitle": "González Pachón, Jacinto - Departamento de Inteligencia Artificial",
    "ogType": "article",
    "image": "/assets/uploads/2016/11/gonzalez-pacjon-jacinto.png",
    "modifiedTime": "2024-01-16T23:10:09+00:00",
    "robots": "index, follow, max-image-preview:large, max-snippet:-1, max-video-preview:-1"
  }
}
